<?xml version="1.0" encoding="UTF-8"?>
<persons xmlns:def="http://www.w3.org/2001/XMLSchema-instance"
         xmlns="http://beans.jd02_09.zhivov.it.by/"
         def:schemaLocation="http://beans.jd02_09.zhivov.it.by/ person.xsd"
>
    <user>
        <name>Zhivov Anton Dmitrievich</name>
        <login>Jerome</login>
        <password>A59915991</password>
        <dateOfBirth>23.12.1994</dateOfBirth>
        <email>jeromeastero@gmail.com</email>
        <tel>+375333830046</tel>
        <privelegy>false</privelegy>
        <ads>
            <ad>
                <title>1</title>
                <description>Best car for 4000</description>
                <brand>Toyota</brand>
                <model>Camry</model>
                <color>Grey</color>
                <body>Sedan</body>
                <year>2009</year>
                <equipment>Full lux</equipment>
                <mileage>126000</mileage>
                <crashed>false</crashed>
                <price>4300</price>
            </ad>
            <ad>
                <title>2</title>
                <description>Lower trash</description>
                <brand>VAZ</brand>
                <model>2106</model>
                <color>Murena</color>
                <body>Sedan</body>
                <year>1992</year>
                <equipment>Standart</equipment>
                <mileage>586000</mileage>
                <crashed>false</crashed>
                <price>250</price>
            </ad>
            <ad>
                <title>3</title>
                <description>Family auto</description>
                <brand>Chrysler</brand>
                <model>Voyager</model>
                <color>Black</color>
                <body>Minivan</body>
                <year>1999</year>
                <equipment>Comfort</equipment>
                <mileage>250000</mileage>
                <crashed>false</crashed>
                <price>5500</price>
            </ad>
        </ads>
    </user>
</persons>